Timestamp,Φύλο,Ηλικία,Σε ποια σχολή σπουδάζετε;,Σε ποιο έτος των σπουδών σας βρίσκεστε;,Σε ποια κοινότητα ανήκετε;,Πόσες σχέσεις είχατε;,Πόσες σοβαρές σχέσεις είχατε;,Ποια θεωρείτε είναι η κατάλληλη ηλικία για σοβαρή σχέση;,Σήμερα βρίσκεστε σε σχέση;,Είστε υπέρ του γάμου;,"Αν ναι, ποια πιστεύετε είναι μια καλή ηλικία για γάμο;",Εργάζεστε;,Μένετε μόνος/η σας;,Πόσα χρόνια διήρκησε η μεγαλύτερή σας σχέση;,Θεωρείτε πως έχει σημασία η διαφορά ηλικίας μεταξύ του ζευγαριού;,"Αν ναι, ποιος πιστεύετε πως πρέπει να έχει τη μεγαλύτερη ηλικία","Αν ναι, ποια πιστεύετε πως είναι η κατάλληλη διαφορά ηλικίας;",Πόσους από τους συντρόφους σας γνωρίσατε στην οικογένειά σας;,Για ποιο λόγο κάνετε μια σχέση;,Πόση βάση δίνετε στην εμφάνιση κάποιου για σχέση;,Πιστευέτε πως μόνο η αγάπη αρκεί για να κρατήσει μία σχέση;,Κάνετε μόνο σοβαρές σχέσεις;
12/9/2022 18:51:11,Άντρας,23,σχολή καλών και εφαρμοσένων τεχνών,3,Ετερόφυλοι/ straight,4,2,22-24,ναι,όχι,,part time,Με την οικογένειά μου,Λιγότερο από χρόνο,όχι,Άντρας,4,3,Για συντροφιά,Αρκετή,ναι,ναι
12/9/2022 18:53:10,Γυναίκα,19,σχολή γεωτεχνικών επιστημών και διαχείρισησ περιβάλλοντοσ,1,LGBTQ+,2,1,30+,ναι,όχι,,όχι,Μόνος/η μου,1-2 χρόνια,ναι,Άντρας,,0,Για το στάτους,Καθόλου,όχι,όχι
12/9/2022 18:54:04,Γυναίκα,20,σχολή διοίκησης και οικονομίας,2,Ετερόφυλοι/ straight,0,0,17-21,όχι,ναι,30,part time,Με την οικογένειά μου,Λιγότερο από χρόνο,ναι,Άντρας,,0,Γιατί βλέπω μακροπρόθεσμα,Πολλή,ναι,ναι
12/9/2022 18:54:56,Άντρας,20,σχολή επικοινωνίας και μεσών ενημέρωσης,3,Ετερόφυλοι/ straight,3,2,22-24,όχι,όχι,,όχι,Με τον/τη σύντροφό μου,Λιγότερο από χρόνο,όχι,Άντρας,,0,Δεν ξέρω/ δεν απαντώ,Αρκετή,όχι,όχι
12/9/2022 18:55:50,Γυναίκα,26,σχολή επικοινωνίας και μεσών ενημέρωσης,6,LGBTQ+,4,2,22-24,όχι,ναι,30,part time,Με την οικογένειά μου,1-2 χρόνια,όχι,Άντρας,,0,Για συντροφιά,Αρκετή,όχι,ναι